<?xml version="1.0" encoding="UTF-8" standalone="yes"?>
<notice:notification
	xmlns:notice="http://www.siemac.org/metamac/rest/notifications/v1.0/domain"
	xmlns:cdomain="http://www.siemac.org/metamac/rest/common/v1.0/domain"
    xsi:schemaLocation="http://www.siemac.org/metamac/rest/notifications/v1.0/domain metamac-notifications-rest-internal-domain-v1.0.xsd" xmlns:xsi="http://www.w3.org/2001/XMLSchema-instance">
	<notice:sendingApplication>application</notice:sendingApplication>
	<notice:sendingUser>user</notice:sendingUser>
	<notice:email>user@domain.com</notice:email>
	<notice:notificationType>NOTIFICATION</notice:notificationType>
	<notice:expirationDate>2013-11-11T12:15:08.606Z</notice:expirationDate>
	<notice:role>ADMIN</notice:role>
	<notice:statisticalOperation kind="operations#operation">
		<cdomain:id>operation01</cdomain:id>
		<cdomain:urn>urn:siemac:org.siemac.metamac.infomodel.statisticaloperations.Operation=operation01
		</cdomain:urn>
		<cdomain:selfLink kind="operations#operation"
			href="http://domain.com/metamac-statistical-operations-web/apis/operations-internal/v1.0/operations/operation01" />
		<cdomain:name>
			<cdomain:text xml:lang="es">operation01 en EspaÃ±ol
			</cdomain:text>
			<cdomain:text xml:lang="en">operation01 in English
			</cdomain:text>
		</cdomain:name>
	</notice:statisticalOperation>
	<notice:messages>
        <notice:message>
            <notice:text>My message</notice:text>
        </notice:message>
    </notice:messages>
	<notice:receivers total="5">
		<notice:receiver>
			<notice:username>user-0</notice:username>
		</notice:receiver>
		<notice:receiver>
			<notice:username>user-1</notice:username>
		</notice:receiver>
		<notice:receiver>
			<notice:username>user-2</notice:username>
		</notice:receiver>
		<notice:receiver>
			<notice:username>user-3</notice:username>
		</notice:receiver>
		<notice:receiver>
			<notice:username>user-4</notice:username>
		</notice:receiver>
	</notice:receivers>
</notice:notification>
